43,FR-STCH-007,Force-Charisme,,PALADIN DE,LA CONFRÉRIE,,,,,Edition Beta,Allié / Confrérie de l'Acier / Arme à Énergie / Gatling Laser / Distance / Deux Mains,,,1,8,Force,Charisme,,1 sur 3,\Etoiles positionnées\Etoile 1 sur 3.png,\Fonds de carte assemblés\Force-Charisme-ruban.png,\Cout positionnés\S-up.png,\Cout positionnés\C-down.png,\Images positionnées\Paladin.png,\Images positionnées\Allié.png,3,/,3,Validé,,Appelez un jeune Paladin de la Confrérie de l'Acier à l'aide pour vous défendre. CONFRÉRIE DE L'ACIER. Tous vos Alliés gagnent +0/+1. ARMURE x2.,,,,,,,,,
44,FR-STCH-008,Force-Charisme,,PALADIN DE,LA CONFRÉRIE,,,,,Edition Beta,Allié / Confrérie de l'Acier / Arme à Énergie / Gatling Laser / Distance / Deux Mains,,,2,9,Force,Charisme,,2 sur 3,\Etoiles positionnées\Etoile 2 sur 3.png,\Fonds de carte assemblés\Force-Charisme-ruban.png,\Cout positionnés\S-up.png,\Cout positionnés\C-down.png,\Images positionnées\Paladin.png,\Images positionnées\Allié.png,4,/,4,Validé,,Appelez un Paladin expérimenté de la Confrérie de l'Acier à l'aide pour vous défendre. CONFRÉRIE DE L'ACIER. Tous vos Alliés gagnent +0/+1. ARMURE x2.,,,,,,,,,
45,FR-STCH-009,Force-Charisme,,PALADIN DE,LA CONFRÉRIE,,,,,Edition Beta,Allié / Confrérie de l'Acier / Arme à Énergie / Gatling Laser / Distance / Deux Mains,,,3,10,Force,Charisme,,3 sur 3,\Etoiles positionnées\Etoile 3 sur 3.png,\Fonds de carte assemblés\Force-Charisme-ruban.png,\Cout positionnés\S-up.png,\Cout positionnés\C-down.png,\Images positionnées\Paladin.png,\Images positionnées\Allié.png,5,/,5,Validé,,Appelez un Paladin vétéran de la Confrérie de l'Acier à l'aide pour vous défendre. CONFRÉRIE DE L'ACIER. Tous vos Alliés gagnent +0/+1. ARMURE x2.,,,,,,,,,
46,FR-STCH-010,Force-Charisme,FAWKES,,,,,,,Edition Beta,Allié / Compagnon / Super Mutant / Arme à Feu / Minigun / Distance / Deux Mains,,,8,5,Force,Charisme,,1,\Etoiles positionnées\Etoile seule.png,\Fonds de carte assemblés\Force-Charisme-ruban.png,\Cout positionnés\S-up.png,\Cout positionnés\C-down.png,\Images positionnées\Fawkes.png,\Images positionnées\Allié.png,5,/,4,Validé,,"Fawkes est un Mutant de Première Génération, il est capable de raisonner ET de faire parler ses poings, mais il a une préférence pour le chant de sa Minigun (oui, elle l'appelle Sasha). « QUI A TOUCHÉ À MON ARME !!??? » : Lorsque cette carte est posée, vous pouvez la défausser n'importe quand pour défausser n'importe quelle carte posée devant un adversaire.",,,,,,,,,
47,FR-PECH-001,Perception-Charisme,CANIGOU,,,,,,,Edition Beta,Allié / Compagnon / Animal / Mêlée / Crocs & Griffes,,,1,2,Perception,Charisme,,1,\Etoiles positionnées\Etoile seule.png,\Fonds de carte assemblés\Perception-Charisme-ruban.png,\Cout positionnés\P-up.png,\Cout positionnés\C-down.png,\Images positionnées\Chien.png,\Images positionnées\Allié.png,1,/,2,Validé,,"Appelez votre fidèle Compagnon, Canigou, pour qu'il vienne vous aider à dénicher des trucs dans le Wasteland ! CARTE DÉSENGAGÉE : Payez son cout pour engager cette carte pendant votre Phase de Jeu et ainsi aller chercher un Objet de votre choix dans votre Bibliothèque.",,,,,,,,,
48,FR-PECH-002,Perception-Charisme,DÉSARMER,,,,,,,Edition Beta,Action / Attaque,,,2,2,Perception,Charisme,,1 sur 3,\Etoiles positionnées\Etoile 1 sur 3.png,\Fonds de carte assemblés\Perception-Charisme-ruban.png,\Cout positionnés\P-up.png,\Cout positionnés\C-down.png,\Images positionnées\Désarmer.png,,,,,,,"Tentez de désarmer un adversaire ciblé, celui-ci se défausse une carte ATTAQUE ou Alliéde son choix depuis sa main, s'il ne le fait pas, il doit vous révéler la totalitée de sa main, et si vous trouvez des cartes de ce type, vous pouvez défausser 2 cartes de n'importe quel type à la place (sauf Aptitude).",,,,,,,,,
49,FR-PECH-003,Perception-Charisme,DÉSARMER,,,,,,,Edition Beta,Action / Attaque,,,4,4,Perception,Charisme,,2 sur 3,\Etoiles positionnées\Etoile 2 sur 3.png,\Fonds de carte assemblés\Perception-Charisme-ruban.png,\Cout positionnés\P-up.png,\Cout positionnés\C-down.png,\Images positionnées\Désarmer.png,,,,,,,"Tentez de désarmer un adversaire ciblé, celui-ci se défausse de 2 cartes ATTAQUE ou Alliéde son choix depuis sa main, s'il ne le fait pas, il doit vous révéler la totalitée de sa main, et si vous trouvez des cartes de ce type, vous pouvez défausser 3 cartes de n'importe quel type à la place (sauf Aptitude).",,,,,,,,,
50,FR-PECH-004,Perception-Charisme,DÉSARMER,,,,,,,Edition Beta,Action / Attaque,,,6,6,Perception,Charisme,,3 sur 3,\Etoiles positionnées\Etoile 3 sur 3.png,\Fonds de carte assemblés\Perception-Charisme-ruban.png,\Cout positionnés\P-up.png,\Cout positionnés\C-down.png,\Images positionnées\Désarmer.png,,,,,,,"Tentez de désarmer un adversaire ciblé, celui-ci se défausse 3 cartes ATTAQUE ou Alliéde son choix depuis sa main, s'il ne le fait pas, il doit vous révéler la totalitée de sa main, et si vous trouvez des cartes de ce type, vous pouvez défausser 4 cartes de n'importe quel type à la place (sauf Aptitude).",,,,,,,,,
51,FR-ENCH-001,Endurance-Charisme,PILLARD RECRUTÉ,,,,,,,Edition Beta,Allié / Pistolet Mitrailleur / Distance,,,1,1,Endurance,Charisme,,1 sur 3,\Etoiles positionnées\Etoile 1 sur 3.png,\Fonds de carte assemblés\Endurance-Charisme-ruban.png,\Cout positionnés\E-up.png,\Cout positionnés\C-down.png,\Images positionnées\Pillard1.png,\Images positionnées\Allié.png,1,/,1,Validé,,"Ces mercenaires bas de gamme sont peu cher, mais pas très efficace. Lorsque cette carte arrive dans votre Zone de Jeu, placez la première carte de votre Bibliothèque, face cachée, sous cet Allié. Lorsque cet Allié est vaincu, placez la carte retournée sous cet Allié dans votre main.",,,,,,,,,
52,FR-ENCH-002,Endurance-Charisme,PILLARD RECRUTÉ,,,,,,,Edition Beta,Allié / Pistolet Mitrailleur / Distance,,,2,2,Endurance,Charisme,,2 sur 3,\Etoiles positionnées\Etoile 2 sur 3.png,\Fonds de carte assemblés\Endurance-Charisme-ruban.png,\Cout positionnés\E-up.png,\Cout positionnés\C-down.png,\Images positionnées\Pillard1.png,\Images positionnées\Allié.png,2,/,1,Validé,,"Ces mercenaires bas de gamme sont peu cher, mais pas très efficace. Lorsque cette carte arrive dans votre Zone de Jeu, placez les 2 premières cartes de votre Bibliothèque, face cachée, sous cet Allié. Lorsque cet Allié est vaincu, placez les cartes retournées sous cet Allié dans votre main.",,,,,,,,,
53,FR-ENCH-003,Endurance-Charisme,PILLARD RECRUTÉ,,,,,,,Edition Beta,Allié / Pistolet Mitrailleur / Distance,,,3,3,Endurance,Charisme,,3 sur 3,\Etoiles positionnées\Etoile 3 sur 3.png,\Fonds de carte assemblés\Endurance-Charisme-ruban.png,\Cout positionnés\E-up.png,\Cout positionnés\C-down.png,\Images positionnées\Pillard1.png,\Images positionnées\Allié.png,3,/,1,Validé,,"Ces mercenaires bas de gamme sont peu cher, mais pas très efficace. Lorsque cette carte arrive dans votre Zone de Jeu, placez les 3 premières cartes de votre Bibliothèque, face cachée, sous cet Allié. Lorsque cet Allié est vaincu, placez les cartes retournées sous cet Allié dans votre main.",,,,,,,,,
54,FR-CHIN-001,Charisme-Intelligence,-,CURIE,MISS NANNY,,,,,Edition Beta,Allié / Compagnon / Robot / Mr Handy / Miss Nanny / Mêlée,,,1,2,Charisme,Intelligence,,1,\Etoiles positionnées\Etoile seule.png,\Fonds de carte assemblés\Charisme-Intelligence-ruban.png,\Cout positionnés\C-up.png,\Cout positionnés\I-down.png,\Images positionnées\Curie.png,\Images positionnées\Allié.png,2,/,4,Validé,,"L'unité médicale C.V.R.I.E. est une vraie mélomane de la scie à os et de la seringue. Chaque fois que ce Compagnon inflige des dégats direct à un adversaire, vous pouvez choisir entre appliquer la Capacité VAMPIRISME ou piocher une carte. Pour une raison inconnue, Curie semble avoir atteint un niveau de conscience émergeant.",,,,,,,,,
